"Conditional Neural Field, Sampling, Data-Driven Method"
"Generalization, Generative Models, Conditional Neural Field, Data-Driven Method"
"Generalization, Conditional Neural Field, Sampling"
"Generalization, Generative Models, Conditional Neural Field"
"Generalization, Generative Models, Conditional Neural Field, Data-Driven Method"
"Generalization, Fundamentals, Conditional Neural Field, Sampling, Data-Driven Method"
"Generalization, Conditional Neural Field, Hypernetwork/Meta-learning"
"Dynamic, Conditional Neural Field, Lifting 2D CNN Features to 3D, Hybrid Geometry Parameterization, Coordinate Re-mapping, Voxel Grid"
"Surface Reconstruction, Conditional Neural Field"
"Beyond Visual Computing, Alternative Imaging, Physics-Informed Neural Networks/Science & Engineering, Conditional Neural Field, Lifting 2D CNN Features to 3D, Data-Driven Method"
"Human (Body), Conditional Neural Field, Hybrid Geometry Parameterization, Data-Driven Method"
Conditional Neural Field
"Generative Models, Conditional Neural Field"
"Editable, Conditional Neural Field, Hybrid Geometry Parameterization, Data-Driven Method"
"Human (Body), Conditional Neural Field, Lifting 2D CNN Features to 3D, Voxel Grid, Feature volume, Coordinate Re-mapping, Data-Driven Method"
"Human (Body), Conditional Neural Field, Lifting 2D CNN Features to 3D, Voxel Grid, Feature volume"
"Generalization, Generative Models, Conditional Neural Field, Lifting 2D CNN Features to 3D, Data-Driven Method"
"Surface Reconstruction, Conditional Neural Field, Hybrid Geometry Parameterization"
"Sparse Reconstruction, Generalization, Conditional Neural Field, Lifting 2D CNN Features to 3D, Image-based Rendering, Data-Driven Method"
"Human (Body), Generalization, Conditional Neural Field, Volume partitioning, Data-Driven Method"
"Sparse Reconstruction, Generalization, Generative Models, Conditional Neural Field, Lifting 2D CNN Features to 3D"
"Dynamic, Segmentation/composition, Beyond Visual Computing, Conditional Neural Field, Object-Centric Hybrid Geometry Parameterization"
"Segmentation/composition, Generative Models, Conditional Neural Field"
"Generalization, Image, Generative Models, Conditional Neural Field, Hypernetwork/Meta-learning"
"Dynamic, Conditional Neural Field, Coarse-to-Fine, Coordinate Re-mapping"
"Dynamic, Human (Head), Editable, Conditional Neural Field, Coordinate Re-mapping"
"Human (Head), Conditional Neural Field, Data-Driven Method"
"Generalization, Conditional Neural Field, Per-instance fine-tuning, Data-Driven Method"
"Image, Fundamentals, Conditional Neural Field, Hybrid Geometry Parameterization, Data-Driven Method"
"Dynamic, Conditional Neural Field, Coordinate Re-mapping"
"Human (Body), Editable, Conditional Neural Field, Voxel Grid, Feature volume"
"Speed (Training), Speed (Rendering), Generalization, Conditional Neural Field, Coarse-to-Fine, Sampling, Voxel Grid, Hybrid Geometry Parameterization, Volume partitioning"
"Generalization, Beyond Visual Computing, Conditional Neural Field"
"Dynamic, Conditional Neural Field"
"Human (Body), Editable, Generative Models, Conditional Neural Field"
"Dynamic, Beyond Visual Computing, Audio, Conditional Neural Field, Volume partitioning"
"Image, Generative Models, Conditional Neural Field, Lifting 2D CNN Features to 3D, Volume partitioning, Data-Driven Method"
"Human (Body), Conditional Neural Field, Coordinate Re-mapping"
"Sparse Reconstruction, Generalization, Image, Generative Models, Conditional Neural Field"
"Generative Models, Conditional Neural Field, Feature volume"
"Segmentation/composition, Conditional Neural Field, Volume partitioning, Object-Centric Hybrid Geometry Parameterization"
"Generalization, Generative Models, Conditional Neural Field"
"Generalization, Compression, Fundamentals, Conditional Neural Field, Hypernetwork/Meta-learning"
"Camera Parameter Estimation, Conditional Neural Field"
"Human (Body), Conditional Neural Field, Lifting 2D CNN Features to 3D, Feature volume, Data-Driven Method"
"Human (Body), Editable, Conditional Neural Field, Articulated, Coordinate Re-mapping, Data-Driven Method"
"Editable, Conditional Neural Field, Articulated"
"Generalization, Segmentation/composition, Fundamentals, Conditional Neural Field"
"Speed (Training), Speed (Rendering), Conditional Neural Field, Coarse-to-Fine, Sampling, Voxel Grid, Feature volume, Hybrid Geometry Parameterization"
"Speed (Training), Speed (Rendering), Generalization, Conditional Neural Field, Hypernetwork/Meta-learning, Hybrid Geometry Parameterization, Sampling"
"Dynamic, Beyond Visual Computing, Conditional Neural Field, Volume partitioning"
"Material/Lighting Estimation, Challenging materials (fur, Conditional Neural Field, Hybrid Geometry Parameterization"
"Dynamic, Fundamentals, Conditional Neural Field"
"Generalization, Editable, Segmentation/composition, Conditional Neural Field, Lifting 2D CNN Features to 3D, Volume partitioning, Object-Centric Hybrid Geometry Parameterization, Segmentation, Data-Driven Method"
"Human (Head), Sparse Reconstruction, Conditional Neural Field, Per-instance fine-tuning, Data-Driven Method"
"Dynamic, Human (Head), Generalization, Editable, Conditional Neural Field, Coarse-to-Fine, Coordinate Re-mapping, Data-Driven Method"
"Robotics, Multi-task/Continual/Transfer learning, Conditional Neural Field, Volume partitioning"
"Human (Body), Sparse Reconstruction, Editable, Conditional Neural Field, Lifting 2D CNN Features to 3D, Voxel Grid, Feature volume, Data-Driven Method"
"Human (Body), Conditional Neural Field, Volume partitioning"
"Sparse Reconstruction, Generalization, Conditional Neural Field, Lifting 2D CNN Features to 3D, Transformer"
"Generalization, Editable, Conditional Neural Field, Per-instance fine-tuning, Data-Driven Method"
"Editable, Conditional Neural Field, Voxel Grid, Volume partitioning, Object-Centric Hybrid Geometry Parameterization, Segmentation"
"Human (Body), Human (Head), Beyond Visual Computing, Physics-Informed Neural Networks/Science & Engineering, Classification, Conditional Neural Field"
"Human hand, Conditional Neural Field, Articulated, Coordinate Re-mapping"
"Image, Generative Models, Conditional Neural Field"
"Human (Head), Generalization, Image, Conditional Neural Field, Hybrid Geometry Parameterization, Data-Driven Method"
"Conditional Neural Field, Lifting 2D CNN Features to 3D"
